{
  "simulation": {
    "total_time_s": 8.861731447604951e-05,
    "dt_s": 2.399552330320532e-10,
    "write_interval": 36930,
    "integrator": "RK4",
    "enable_gpu": false,
    "enable_openmp": true,
    "rng_seed": 42
  },
  "physics": {
    "collision_model": "EHSS",
    "enable_space_charge": false,
    "enable_reactions": false
  },
  "species_database_path": "/home/chsch95/ICARION/data/species_database_v1.json",
  "output": {
    "folder": "results/v1.0_test/instruments/ims",
    "trajectory_file": "ims_ehss_24143Vm_1000Pa.h5",
    "print_progress": true
  },
  "ions": {
    "species": [
      {
        "species_id": "H3O+",
        "count": 10000,
        "position": {
          "type": "gaussian",
          "center": [
            0.0,
            0.0,
            0.0
          ],
          "std": [
            0.0005,
            0.0005,
            0.0001
          ]
        },
        "velocity": {
          "type": "thermal",
          "temperature_K": 300.0
        }
      }
    ]
  },
  "domains": [
    {
      "domain_index": 0,
      "name": "IMS Drift Tube",
      "instrument": "IMS",
      "geometry": {
        "origin_m": [
          0.0,
          0.0,
          0.0
        ],
        "length_m": 0.05,
        "radius_m": 0.05
      },
      "env": {
        "gas_species": "He",
        "temperature_K": 300.0,
        "pressure_Pa": 1000.0,
        "gas_velocity_m_s": [
          0.0,
          0.0,
          0.0
        ]
      },
      "fields": {
        "DC": {
          "EN_Td": 100.0
        }
      }
    }
  ]
}