{
  "simulation": {
    "total_time_s": 5e-05,
    "dt_s": 1e-09,
    "write_interval": 50,
    "integrator": "RK4",
    "enable_gpu": false,
    "enable_openmp": true,
    "rng_seed": 42
  },
  "physics": {
    "collision_model": "HSS",
    "enable_space_charge": false,
    "enable_reactions": false
  },
  "species_database_path": "/home/chsch95/ICARION/data/species_database_v1.json",
  "output": {
    "folder": "validation/results/v1.0_test/instruments/quadrupole_stability",
    "trajectory_file": "quad_q0.910_a+0.200.h5",
    "print_progress": false
  },
  "ions": {
    "species": [
      {
        "species_id": "CaffeineH+",
        "count": 100,
        "position": {
          "type": "gaussian",
          "center": [
            0.0,
            0.0,
            0.0
          ],
          "std": [
            0.0005,
            0.0005,
            0.001
          ]
        },
        "velocity": {
          "type": "thermal",
          "temperature_K": 300.0
        }
      }
    ]
  },
  "domains": [
    {
      "domain_index": 0,
      "name": "Quadrupole q=0.910 a=+0.200",
      "instrument": "LQIT",
      "geometry": {
        "radius_m": 0.005,
        "length_m": 0.05,
        "origin_m": [
          0.0,
          0.0,
          -0.025
        ]
      },
      "env": {
        "gas_species": "He",
        "temperature_K": 300.0,
        "pressure_Pa": 0.01,
        "gas_velocity_m_s": [
          0.0,
          0.0,
          0.0
        ]
      },
      "fields": {
        "RF": {
          "voltage_V": 453.7897746420097,
          "frequency_Hz": 1000000.0,
          "phase_rad": 0.0
        },
        "DC": {
          "quad_V": -49.86700820241864,
          "axial_V": 10.0
        },
        "AC": {
          "voltage_V": 0.0,
          "frequency_Hz": 0.0
        }
      }
    }
  ]
}