{
  "simulation": {
    "total_time_s": 2e-03,
    "dt_s": 1e-08,
    "write_interval": 100,
    "integrator": "RK4",
    "enable_gpu": false,
    "enable_openmp": true,
    "rng_seed": 42
  },
  "physics": {
    "collision_model": "HSS",
    "enable_space_charge": false,
    "enable_reactions": false
  },
  "species_database_path": "/home/chsch95/ICARION/data/species_database_v1.json",
  "output": {
    "folder": "results/v1.0_test/instruments/lqit",
    "trajectory_file": "lqit_hss_q0.700_a-0.000.h5",
    "print_progress": true
  },
  "ions": {
    "species": [
      {
        "id": "H3O+",
        "count": 1000,
        "position": {
          "type": "gaussian",
          "center": [
            0.0,
            0.0,
            0.0
          ],
          "std": [
            0.0005,
            0.0005,
            0.001
          ]
        },
        "velocity": {
          "type": "thermal",
          "temperature_K": 300.0
        }
      }
    ]
  },
  "domains": [
    {
      "domain_index": 0,
      "name": "LQIT Stable q=0.7",
      "instrument": "LQIT",
      "geometry": {
        "radius_m": 0.005,
        "length_m": 0.05,
        "origin_m": [
          0.0,
          0.0,
          -0.025
        ]
      },
      "env": {
        "gas_species": "He",
        "temperature_K": 300.0,
        "pressure_Pa": 0.1,
        "gas_velocity_m_s": [
          0.0,
          0.0,
          0.0
        ]
      },
      "fields": {
        "RF": {
          "frequency_Hz": 1000000.0,
          "voltage_V": 34.0476588311283,
          "phase_rad": 0.0
        },
        "DC": {
          "quad_V": 0.0,
          "axial_V": 10.0
        }
      }
    }
  ]
}