{
  "simulation": {
    "total_time_s": 1e-05,
    "dt_s": 1e-09,
    "write_interval": 10000,
    "integrator": "RK4",
    "enable_gpu": false,
    "enable_openmp": true,
    "rng_seed": 42
  },
  "physics": {
    "collision_model": "NoCollisions",
    "enable_space_charge": false
  },
  "output": {
    "folder": "/home/chsch95/ICARION/validation/results/performance/gpu/RK4",
    "trajectory_file": "cpu_N5000.h5",
    "print_progress": true
  },
  "ions": {
    "species": [
      {
        "id": "H3O+",
        "count": 5000,
        "position": {
          "type": "gaussian",
          "center": [
            0.0,
            0.0,
            0.005
          ],
          "std": [
            0.001,
            0.001,
            0.001
          ]
        },
        "velocity": {
          "type": "thermal",
          "temperature_K": 300.0
        }
      }
    ]
  },
  "domains": [
    {
      "name": "CPU Benchmark (N=5000)",
      "instrument": "IMS",
      "geometry": {
        "origin_m": [
          0.0,
          0.0,
          0.0
        ],
        "length_m": 0.05,
        "radius_m": 0.01
      },
      "env": {
        "temperature_K": 300.0,
        "pressure_Pa": 1e-06,
        "gas_species": "He",
        "gas_velocity_m_s": [
          0.0,
          0.0,
          0.0
        ]
      },
      "fields": {
        "DC": {
          "EN_Td": 0.0,
          "axial_V": 0.0
        }
      }
    }
  ]
}