{
  "simulation": {
    "total_time_s": 0.0002,
    "dt_s": 1e-9,
    "write_interval": 20000,
    "integrator": "RK4",
    "enable_openmp": true,
    "enable_gpu": false,
    "rng_seed": 31415
  },
  "physics": {
    "collision_model": "None",
    "enable_space_charge": false,
    "enable_reactions": false
  },
  "species_database_path": "data/species_database_v1.json",
  "output": {
    "folder": "validation/results/v1.0.0_test/performance/thread_scaling_large",
    "trajectory_file": "scaling_cpu_cores.h5",
    "print_progress": true
  },
  "ions": {
    "species": [
      {
        "species_id": "H3O+",
        "count": 200000,
        "position": {
          "type": "uniform_box",
          "min": [0.0, 0.0, 0.0],
          "max": [0.02, 0.02, 0.02]
        },
        "velocity": {
          "type": "thermal",
          "temperature_K": 300.0
        }
      }
    ]
  },
  "domains": [
    {
      "domain_index": 0,
      "name": "Large-N thermalization",
      "instrument": "NoFixedInstrument",
      "geometry": {
        "type": "box",
        "dimensions": [0.02, 0.02, 0.02],
        "origin_m": [0.0, 0.0, 0.0]
      },
      "env": {
        "gas_species": "He",
        "temperature_K": 300.0,
        "pressure_Pa": 0.1,
        "gas_velocity_m_s": [0.0, 0.0, 0.0]
      },
      "fields": {}
    }
  ]
}
